complaints_text_massachusetts,complaints_text_arizona
After reading a few reviews I had to write my own because I have run into the same problem. I have had Comcast for 7 months now and all I wanted to do was a simple address change and before I began Comcast put a random number on my account without asking me for one and they said they tried to contact me multiple times. So after I put the request to change to address I received a call from a lady named Andrea from the activation team stating I have a past due account from 2012 where I had cable for barely 2 months and before I switch my account I have to pay for it. 2012 I have no recollection of this and let me remind you I had service for 7 months. Paid on time and everything and paid off a previously owed bill. Long story short this Andrea lady put a block on my apartment so my roommate cannot get cable either and Comcast is the only cable service that is available in my area. SMH. My thing is I didn't receive one letter nor is it on my credit report that I owe anything from 2012 to Comcast so I'll continue to use their internet and on demand service free of charge since they won't let me pay for service that I already had.,
"It doesn't matter how much we, the customer/consumer (this is the Consumer Affairs website) complains about the extremely bad and very expensive service that Comcast does not provide because Comcast and the government are in bed together. Therefore, nothing will happen because Comcast does not have to answer to anyone. I have, as many others so many problems with Comcast only to have them unresolved. The new Xfinity 1 is probably the worst experience with TV watching I have ever had. When I switched, I was forced to have their modem and router together and the damn thing keeps disconnecting my wireless printer. I'm thinking it is when they do their updates in the wee hours in the morning. That is a treat to have to reset the printer & the tv after a reset.The phone service is one step below two soup cans and a string. Voice mail that dumps week old messages, even deleted messages into your mailbox 7 days later. Supervisors give you their phone numbers so you can call them directly, what a joke. They don't answer and they definitely don't return the phone call. DVR doesn't record scheduled recording, either series or just one show but it records other shows. It's selective recording or the NSA getting into our DVR boxes and deciding what we can record and watch.",
My experience with Comcast has been so stressful that I can hardly sleep. For one my bill is 688 and 80% of that is overcharges! My privacy was violated as they let someone have access to my account with my permission and without my SS number. I have called numerous times to try and get answers to why this happened and spoke to numerous people. One lady laughed at me and was extremely rude. Another man told me the person who tried accessing my account gave them my SS number. Every time I call I get different answers or they have no clue what I'm talking about! This place needs to be shut down or have some sort of investigation. There hidden costs and add on every month. One time they came to my house and took our line off the phone pole to disconnect us for no reason! So we had no service for days and nothing was done about that either! This company makes me sick. There is also more I haven't added but don't have time to write a novel.,
"When there was an issue with speed (MBPS), Comcast reps told me to buy their router for 10$ a month. That didn't fix it and I lost the salvage value of my own high-quality router from Best Buy, and am now paying another 10$ a month in addition to those damages incurred to me (and others, so I hear) by Comcast. After this didn't fix the issue, they wouldn't provide recourse and then required that I upgrade for about another 40$ a month to get my service working. These are bait and switch sales practices and are easy regulations. The company can be doing this to many people from the sampling obtained so far, and they will be paying millions. Attorneys, take note. If you don't see this in the news quickly, you better gobble it up for your firms. We're in the process of filing promptly to incentive them to stop doing this to their clients, not to exclude antitrust problems.",
I haven't needed a lot of support. My most recent call was to confirm that I had the latest cable box. The person I spoke to was very pleasant and helpful. I have had very few outages and the system has always been restored in a reasonably quick manner. I am on the 2nd year of a new contract so I get a lot of channels for a reasonable price. When this year is up I will reduce my cable services to maintain a price close to my current price. No problems with reliability. There are services I currently have but I don't use like DVR and many channels I don't watch. If I was paying retail for these services my cable bill would be much higher.,
"I have called multiple times for various problems and it's like I never called before. They have no record of my complaint, only that I have called. I have been waiting two weeks for a downed cable in the middle of our road. The fire dept finally had to come and cut the cable for safety reasons. They seem clueless and could care less every time I have called with an issue. They are a ripoff and continues to try and find ways to pork the customer. Such as, raising internet prices for customers who watch Netflix more than cable. They're going to find a way to make more money any way they can. I have never experienced a worse cable company than Comcast. I've called multiple times for this recent downed wire and they tell me each time the customer service representatives didn't put any notes in the system. Are you kidding me??? They suck, and if I had another option for internet, local news, and sports, I would cancel Comcast in a heartbeat.",
"Tried to pay my bill on Saturday. Was not able to access account online. Got a message my email address wasn't connected to the account. So I called waiting over a hour to make payment. I gave up. Made payment through my bank online. Well they didn't get it fast enough, shut my cable off, charged me fees, and I called today 2-8. After 3 transfers and 45 min later I got my service back on. I was asked 3 times how I sent the money. They are a monopoly. I hate them and there is no other provider allowed in my area. It is so horrible the way they treat their customers.",
"I changed a cable box from one bedroom to another. I called customer service to help reprogram the box. Well what a SURPRISE, they couldn't do it over the phone because they were incompatible. They send a representative over and then charge me a 38$ for coming to program a box! No notice on any fees just a charge. I call customer service. The rep. tries to tell me they changed a wire! Well my ** that happened, no wires changed! The representative basically called me a LIAR when I asked to speak to her manager and flat out refused! There has gotta be something we can do! Any suggestions?",
"I just called to reduce my bill and now Comcast has already increased two ""fees"" on the bill. I got no warning of the increases, and no explanation as to why these increased. Also with the new ""plans"" they offer, you have to pay for premium channels even though they are old movies and they run over and over. I don't want these channels but to get HD service, I have to go with this package and pay a higher price. It isn't fair and they are taking advantage because there is no competition in the area. I wish there was some competition in my area and I would switch in a heartbeat. This is not an isolated complaint, I have had to subscribe as I have no other choice. The bill is a different amount every other month and it never decreases. I am not getting anything better as a result either. Customer service is a joke. They just read from a script.",
This was the second time I had to call as they don't change the programming like they say they are going to. I would not even have Comcast but the apartment complex I live in won't let us have DirecTV. 4 more months of living here till our lease is up. Then we will have DirecTV again. Comcast sucks.,
"We were forced to use Comcast as the apartment building we are in uses those services exclusively. The DVR works 30% of the time, often not recording TV shows we have it set to record and not displaying any on demand shows. This is the biggest waste of money and we will NEVER use this company again.",
"I have never seen such a horrible service like Xfinity. Wish we have TWC or Verizon in my place. I am sharing some of my experiences below: Last week by mistake I clicked the upgrade modem link. I already have a docsis 3.0 modem, so I called the customer support and asked them to cancel the order. They said they took care of it. After 5 days I got the equipment from Comcast. Now I called them and after 30 minutes service desk told me to return it asap. Now I need to find a center and return it. For last few days, I am seeing tv service has been added to my account. I called customer care and told them I don't need TV service, cancel it. They said TV service not added to my account and no clue why it got added to my account. She said my plan is unchanged but I am not sure if Comcast will charge anything extra. After interacting to Xfinity customer care, it seems some time they are not aware of the things or mislead you.",
"Off to Target to buy a router/modem for my ‪XFINITY‬ service. Just in case anyone else was a gullible as I have been I want to let you know. When I signed up for XFINITY I asked if I could buy my own modem rather than ""rent"" theirs. I was told by their representative no I could not. That only theirs would work, no other kind was compatible. I am not the most techno knowledgeable person out there so I believed him. I have bought and paid for that damn thing multiple times over the years and I am pissed. When a friend was telling me about how they got a new modem at Target I was baffled. ""You can do that?"" So I am going to go get one, bring it home and make sure I can make it work. And then I am off to Comcast Cable to give them their damn modem and a piece of my mind (a small one, I don't have much to spare right now.) I feel bad for whoever gets me. I know it's not their personal fault but unfortunately they are going to have to hear about it. What a dirt bag lying piece of ** I dealt with. No idea who it was, I bet they don't work there anymore. So if you were lied to too, get your own modem, save money and tell them what they can do with it. Have a nice day.",
"Comcast raises prices throughout your 2 year contract. Each month my bill has been more than the previous bill. It went from 198.00 to 295.00. When I called Comcast customer service to find out what was going on, she stated that all the promotion deals are rolling off due to it coming to a end of my contract. If this was a 2 year contract why are all the promotions rolling off monthly before the 2 years expired. Then she tells me my next month bill will be much more than 295.00. I will be canceling and finding a new provider. This company has been a headache for me for years. Really Bad Company.",
"On August 11th I was watching a show on demand. All of a sudden my tv froze and my phones and Internet stop working also. I called Comcast and got disconnected 3 times. Was bounced around to multiple people and had to repeat myself over and over again, never mind the wait time. Finally someone fixed my phones and Internet. To this day August 14, my cable on my main TV and demand doesn't work. I'm a court officer in a busy busy court, Comcast stated that they would call my cell phone when they were going to be at my house on 8/14/15, surprise they never did.I asked my chief if I could leave because they were supposed to call between 1-4. I got home at 1:30 and received a message on my HOME PHONE that they was here and no one was home and that I would have to reschedule. So I left my job early, having to use my time and I haven't had cable or demand since 8-11. But my bill is paid every month. I think this company is the most unprofessional incompetent company I have ever dealt with. I plan on reporting them to the better business and telling anyone and everyone not to ever get Comcast. You would think that they would want to be proud of their company and do whatever it takes to help these customers. Not them. They are shameful.",
"Called Comcast to set a payment arrangements for a old account. The first gentleman I spoke with (wish I could remember his name) was a delightful, very sweet, helpful. Had patience pulled up my old account and transferred me to the collection department where I would be assisted further. After being on hold for 35 mins!!! The employee ""Phill **"" in collections was very loud, rude, didn't help me at all!!! He asked for a account number which I do not have, and considering another employee was able to locate a old account with no issue! Why can't he??? I asked to speak with a supervisor... He said they were all busy. I implied I would wait for one to be available (I work in a call center, a superior should be available at all times). He insisted that they were helping with calls due to the high call volume... which is ridiculous to me. Comcast you should get more employees if you have to take your superiors away from their job to help with another job!!! The agent ""Phill **"" was not customer services... He did not go out of his way to help me!!!! He was not polite nor sound friendly nor like he was smiling through the phone. He had a very angry tone and was very short. He is not what I want to speak to when I call a company - your employees represent you!!!Customer satisfaction is always a number one goal!!! Your call center employees are your direct contact to your customers!!! If a employee can not deal with stress, ongoing pressure, high call volume and can't assist a customer engaged and be personal make sure their experience with you was the best you could possible be, then fire them!!! I want someone that can help me after sitting on hold for 35 mins, not a employee that won't go above and beyond to assist me with my problem!!! You're called customer service representative for a reason - you represent Comcast. Comcast do a better job with the employees you hired. Horrible business. Also make sure you guys do coaching with your employees!!! Listen to the call with them. Help them fix errors or mistakes so they can become better!!!",
"Absolute worst customer service I have ever had. They transfer you to three separate people with thick accents and terrible reception who need you to tell them the information over and over again until they go, ""Oh, it looks like it's expired/not available/out of service."" SWITCH to another to provider and break up their monopoly. Please.",
I went to Comcast office and I ask if I can pay my final bill but the guy told me that he was going to mail it to me to my new address. I received a bill for $345.00 and I paid that bill because I thought it was my final bill and all of a sudden I found another final bill for 97.36 within two weeks of paying. I called customer service and talked to a guy name Net and explained to him about my reason for calling that I received a letter from credit bureau about the $97.36 and he hanged up on me. I was really surprise and mad that I never even received notice from them that I owe them money. I always pay my bill on time and I don't believe that it was necessary for them to take it that far for only $97.36. BE AWARE OF COMCAST BECAUSE WHAT THEY TELL IS NOT WHAT THEY DO. Make sure to record them when you have them on the phone. ,
"I have had problems with Comcast forever. Speaking with representative is useless and getting things resolved is frustrating. Recent conversation dealt with moving out-of-state, no service provided but yet charging term fee! Avoid!!",
I think Comcast are con artist and there should be an investigation because they tell you one price and make it easy till you get the high bill. Also they charge a month advance. Then if you move they charge 2 month in advanced. I think they are gold diggers.,
I have been in queue for online chat with a customer service rep for 40+ minutes. I've been 1 in queue for 20 minutes. I chose online chat because I didn't want to get stuck on hold for an hour on the phone. I have one simple question--where is my self-service box that was scheduled to arrive 3 days ago? I can't get internet access without it.,
I find it amazing that Comcast can run a commercial about customer service. Their customer service is the poorest that I dealt with in my life. When I asked to go to corporate level I'm told I can mail them a letter. Unbelievable. If you have any choice definitely don't pick Comcast.,
"DO NOT SUBSCRIBE TO COMCAST. Due to the virtual monopoly that Comcast holds over the Greater Boston area I had no choice but to use this company. They are HORRIBLE! I just finished my 5th, that's right, 5th call with Comcast this month to dispute my bill. Originally, I called because a bundle deal I had apparently expired, even though when I initially signed up for the bundle I was told there would be no expiration on the rates. I called and explained the situation and was told that there had been a mistake and rates had gone up. I was then forced into signing up for a bundle again (or so I thought) because I was told that it was the cheapest rate. Since that first call three weeks ago, my bill has risen by almost 40$. Each time I call, I then go look at my account and Comcast has added more fees on instead of reducing them as I was guaranteed they would. I have basic cable and high-speed internet and my current bill is MORE than what I used to pay with full cable and Internet!!! I called again today and was told that the bundle I was offered was non-existent! Apparently there was a technical error on their computer system yet I am being held responsible for this bill. Comcast never bothered to notify me this deal was unobtainable nor did they offer any insight into how to rectify the problem. All I was told, by a senior supervisor, was that I had to pay the bill and it would be rectified next month. I told the supervisor I was moving out of the state and would be canceling Comcast this month so there would be no future bills. Supervisor essentially told me ""tough luck"" and then became defensive when I said I felt manipulated by this company. I told the supervisor that I wanted to cancel everything right then and there, but apparently that's too much for Comcast to handle. Agents can't rectify cancellation issues and I was told I have to call another division, no contact information, no helpful tips, nothing. This is the WORST company I have ever dealt with and their service is something comparable to toxic sewage. In fact, I am going to make it my personal mission to help everyone I know and encounter to also become disillusioned with this horrendous business model. I will be sure to post reviews of this nature on every site that I can and I will never, ever use this company again. I would rather be mauled by a pack of wolves than give Comcast my business and you should be aware that if you use this company you will be ROBBED!!! If there was a choice more emphatic than angry, like ""volcanic eruption of rage"" I would have chosen that. Angry is the biggest understatement of the century. Get it together Comcast. Oh wait you can't, because your very foundations are the definition of vile and evil.",
"My business relationship with Comcast began June of 2014. I had recently moved into a rooming house with multiple cable hookups and wanted to get internet access. Since they are the only provider in the area I called their ""customer service"" number. I was told that I could easily go to the local office to pick up a self install kit to get up and running. So off I drove to the address they provided and upon entering discovered that I was given the address of their local marketing office! No worries, they gave me the correct address and I proceeded down the road to pick up my easy self install kit. Got to the office-great service, got home, and hooked up my computer to the cable in my room. My computer was online, but my neighboring roommate lost his cable service. Apparently the line that was installed in my room was actually his, so called ""customer service"" and set up an appt to have a tech to install (costing me more $$$). Success! Internet was installed and all was well... but in March 2015 received a call from a Comcast telemarketer offering me cable tv service added to my internet for only 5.00 more a month! Good deal so I said why not, she proceeded to send me an easy self install kit. Upon receipt, realized that with the way my cable was set up I could not self install. Did not want to pay for another tech to come out, so within 3 days took a trip to my local Comcast office and was assured that I would not be charged for the cable TV and my acct would return to the previous billing. Surprise! First week of April received a bill from Comcast. For the months prior to the telemarketing offer I was paying about $52.00 for internet service (overpriced in my opinion, but my only option). The bill was for $105.00!!! Called the customer service # and spoke to a nice guy who said he could credit me $10.00 for the cable tv self install kit, but I would have to talk to a representative in special relations to resolve the rest. He did agree that I should not be charged double for the same service. After being on hold for several minutes special relations rep told me that although I was offered a 30 day money back guarantee by the telemarketer, and I did cancel the cable TV service within 3 days, the offer I signed up for 9 months previous did not exist anymore! After going around in circles with her for several minutes she said she could sign me up for an ""economy"" internet plan for the same price I was paying previously (approx $52.00 with rented modem). She recommended that I pay my bill $95.00 (after the generous $10.00 credit!) and all would be resolved in my next billing period. So I checked out my acct online last week, and guess what??? I am still signed up for a cable TV and internet bundle for $105.00 month!!! I cannot deal with the telephone customer service"" people anymore, so will return to my local Comcast office to cancel everything asap. People should not be treated this way!!!",
"I am so frustrated. It's been over a week and I am still not fully connected. Here are my string of complaints: The sales representative only gave me 2 options to get my cable equipment, either spend $10 to receive it by mail or $80 to have a technician to install it. She did NOT mention that I could simply pick it up and get my cable hooked up right away. Oh, but of course, when I mentioned if I could get it faster, she said I could pay more for shipping to receive it the next day.The box came 5 days later with a set top box and two other smaller cable boxes (far too many). NOWHERE was the internet modem, which was most important part and the whole reason I'm stuck with Comcast in the first place (Sadly, Comcast monopolizes my area). I thought I had everything needed at first (the instruction manual is terrible), so I called to get the set top box activated. After a half hour of struggling with the sales representative, she told me that I needed to call the billing department to receive my services.Next day called customer service, surprise surprise, I didn't need to call the billing department. I also figured out through my own research that I needed that internet modem. Picked up the internet modem at the local Comcast store. Had to call 2 sales representatives to finally get it working. Then I find out that I need a splitter in order to use the same cable outlet for both internet and TV.Go to the local Comcast store AGAIN to pick up the splitter. Returned the extra little cable box I was sent (What a waste of packaging when I could've had that internet modem instead). Everything is hooked up and I call to set up the cable. Robot sends me to a sales representative and guess what? THE SET TOP BOX DOESN'T WORK. Looks like yet another trip to the Comcast store. I mean really, is it so hard to pack up the right things and make sure everything works? I want my $10 spent for shipping, this is ridiculous. I would never recommend Comcast to anyone EVER.",
