complaints_text_massachusetts,complaints_text_arizona
"When I walked into the local Comcast store to pick up a new cable box, the young woman at the desk noticed that I had been billed for a piece of equipment that I never requested, had, or used. She said that I had been billed for this ""adapter"" or something like that, since 2009 and should be reimbursed (or credited) by Comcast. (She was lovely.)Fast forward about a year, I returned to Comcast to see about what had been done about the overcharging and it appears nothing had been done. I was assured that it would be fixed and was given a ticket number. Bear in mind that I have automatic deductions (from my bank account) for my monthly bill, and Comcast has not sent either paper or electronic bills in years.As per my request, I received an electronic bill the other day. They only credited me for the last six months of overbilling. I called and was told that the two agents that I had spoken with in person were wrong about my reimbursement - that Comcast has a strict policy that they will only, in essence, fix any of their mistakes from the last six months. I explained that I had spoken with someone a year ago and nothing was done. I also explained that I had no knowledge of being overcharged since they never sent me a bill.I'm basically an easy-going person, but when something this egregious happens to me, and most probably is also happening to others, I became, well, apparently 1 Star indicates ""angry"" so I'll leave it at that. I'm waiting for a supervisor to call me back (I'm not holding my breath) but the amount of time I've already spent trying to remedy THEIR mistake is ridiculous. How can they operate a business where they recognize their mistake and yet only agree to repay a small portion of a sum that they realize was erroneously deducted from my bank account?",
"A few days ago, I spoke to a salesperson to get service. I agreed to pay $109 without phone service, and that was the deal I made with them, plus $12 extra in order for me to get 105 Mbps of internet speed. I was also charged for three boxes. When the technician showed up and set up my service in my home, I got 12 Mbps instead of 105 Mbps. When I asked him why this had happened, he said that I should call the company so they could send me a technician from a different department to get a booster so I could get the internet speed I originally paid for. One of the customer service representatives told me to go to Best Buy and purchase the booster since the company didn't have them anymore. Another representative told me that my area does not have 105 Mbps. Now I am getting confused because the salesperson told me that I could get 105 Mbps, and the website also says I can get 105 Mbps. But now, the customer service representative is telling me that I cannot reach 105 Mbps, so now I'm confused. I'm urging every Comcast customer to check their internet speed, and see if it's what they're paying for. Comcast lies about what they promise to provide, and overcharges!",
"Is there ** minus stars??? I asked for a lower package, by taking off TV services, and to reduce the speed of the internet. What I found is that I am paying more (for the most expensive package of TV + phone services and internet!!! ) WT**!!! But I am only getting a slower speed service!! Those customer services/so called technicians gotta get it together! If you don't want to work, then don't! There is a reason why you are answering phone calls, first of all. It shouldn't be such a hard job, suck it up! Don't take your own problems on customers!",
"I contacted Comcast to set up cable and internet at our new apartment. I spoke with a representative and agreed to a deal where we would get cable, internet, and a DVR for around 100/month. Pretty good. A technician came 4 days later and hooked everything up. The internet worked fine but the cable box was buggy. The next day, I unplugged it and rebooted it which worked for a day and then nothing. On the next evening, I called back and after about 30 min on the phone, the rep said that a technician needed to come and fix it. This was on a Friday and a tech wasn't available until Monday. Monday: tech comes and says a cable was loose and that the box should be fine (I was suspicious, but I let it go). The box was fine... for an hour. When I got home from work, the box is completely frozen and won't change channels or anything. Also, that Monday, I received a bill for $260! I call Comcast, and tech support tries to tell me that I'm using the remote incorrectly. I'm not, I know how to work the remote, I promise you. So needless to say, I'm getting upset. So I tell them that I no longer want their cable service and just want the internet that was advertised at $40/month. They tell me that offer is available to new customers only, and since I am an existing customer, I would have to pay $80/month for the service. Seriously!? That was it, I cancel everything. Unfortunately, there are no real alternatives in my area. Comcast needs more competition. They have so much control that they can easily get away with hidden charges and fees and extremely poor customer service because only they can provide broadband service to a public increasingly reliant on such a service. It's time that we demand an alternative to this corrupted company.",
"Comcast must be the most incompetent company I've ever dealt with!!! I never write these types of reviews, but I already wasted so much time with Comcast, that I may just as well waste more to let others know to stay away from them if they don't want to be frustrated by their incompetency and lack of customer service. I had their cable/internet service at the previous address and moved. They scheduled a technician to hook up service. I had to stay home from work. He came but told me he was the wrong guy, because the house needed a rewire, but he'd put in a ticket. Nobody contacted me, so I called customer service a few days later. They said a technician is already scheduled for tomorrow. So I stayed home from work again. The technician came and, incredibly, told me the same thing: that he's the wrong guy and that Comcast needs to send somebody from another department to do a ""rewire."" He said he'd put in a ticket and to call the next day to confirm.I called the next day, but they couldn't find anything. I spent about 3 hours on the phone trying to reach the right group to schedule a rewire and get free backup wifi service from them in the meantime. They said I'd have to call another department to get the backup wifi service. So I did; only to have that other department tell me that I can't get free wifi service because I don't have Comcast service. I tried to explain that I didn't have Comcast service because they sent the wrong technician TWICE. They said I had to talk to another department and connected me. After being on hold for 30 minutes, the person from the other department told me I would have to call the wifi department. I told them that's who I talked to earlier. So they told me they couldn't do anything, but recommended to call a different department the next day to schedule the rewire job.I called that other department the next day and, after 30 minutes on the phone, found somebody who seem to know what's going on. They said they'll schedule the rewire technician to come by in a week. That's today. So I just received a call from Comcast early, saying the technician will be coming 1.5 hours late (after the 2-hour window they gave me). Out of caution, I asked them if the technician is coming to do the rewire job. They then told me NO! Their group doesn't do any rewire jobs and that needed to be done by the rewire group at Comcast. I just about lost it!!! The service person said they'll call the Comcast rewire group, put me on hold for 15 minutes, and said somebody from over there would call me right away to schedule a rewire appointment. That was an hour ago.CAN ANYBODY BELIEVE THAT??? I'VE NEVER DEALT WITH A COMPANY WHO SHOWED THAT LEVEL OF INCOMPETENCE, DYSFUNCTIONALITY, AND TOTAL DISRESPECT OF THEIR CUSTOMERS' TIME!!!!",
"I had been a customer of Comcast for 8 years and until we moved we had not experienced much in the way problems with internet and On Demand. When we moved into our new house we started getting intermittent internet connections. We also started having problems with On Demand access. Every time we had a problem Comcast said they couldn't duplicate it and there was nothing wrong with the service.What finally made me decide to move to another service was that I decided to pay my bill early. It showed as an option on the website even though I was enrolled in Auto Pay. Well a few days later they deducted the payment again from my checking account. When I called they said that I would have had to cancel my enrollment in Auto Pay before paying early. It said nothing about that on the website. It took them 3 weeks to process the refund to my account.I cancelled my service on January 29th. On February 9 they deducted another month's payment from my account. Then they sent me a bill with a credit on it for a partial month rather than just deducting what I really owed them for for the February 9th bill. When I called to see when I was going to get my money back, I was told that it takes 4-5 weeks. That's ridiculous that they will have had my money for a total of 2 months. I would look at other providers first before doing anything with Comcast.",
"Why does it take five appointments and a dozen calls to get service? I have had comcast for many years but they contract with untrustworthy technicians. On this day I have been waiting and given a third time for which I can expect the tech to come to my home. I haven't even taken into consideration all the snow we had had in Boston but everywhere I look I see XFINITY trucks but they will not come to my house. I had one lie and said he came but nobody answered the door. Fresh snow had been falling all morning and there were no tracks indicating that someone had been to the house but this is acceptable!So far to date I have been given $120 in credits for NO SHOW TECHS! Today as I sit here waiting since 7:30 am for my scheduled appointment slot of 8 - 10, 11 - 12 and this last time 1 - 1:30 the rep guaranteed me I would get installation today! I have spent countless hour waiting on tech to install my cable, phone and Internet. If there were a better cable supplier I would go with them but I heard horror stories about Directv, RCN and Verizon.",
"Snowstorm - tree came down, took out all wires. NSTAR was there in under 24 hours, climbed the pole and power back on. After 4 no-show appointments from Comcast we finally were told our appointment had been cancelled. No call, no nothing, they said our driveway was not plowed well enough, so they just canceled our 4th appointment. The driveway HAD BEEN completely plowed and we have been driving in and out all day. Our 5th appoint, which Comcast tagged an emergency by the Comcast help desk is, again, a no-show. We are losing money everyday as one of our family members is an independent contractor who is dependent on our internet service. Why can this monopoly of a service on Cape Cod be allowed to continue to abuse and lie to customers. Can nothing be done about this? I am begging you to look into this matter. How can a company hold their customer hostage like this???",
"So I am now on the third day waiting for them to actually come to my house to install equipment. I laugh at their commercial that says 2-3 hour window appointments, HA! Yea, sure! This is by far the worst service in all aspects whether it be customer service or in home installation--they stink! In Quincy MA Comcast is a monopoly. There is no other service available for internet and tv. And they know this, I believe that's why they're such jerks. Calling them is incredibly frustrating. I now have to take off another day for the fourth time so I can sit around for an appointment they probably won't make either. Their service stinks, it's way too expensive. Also I tried to go online and order the DVR and have it mailed to me--never came. This is also the second time doing that so figured I'd try inhome appointment... again even more pointless.",
"Comcast is asking customers to sign up for a two year commitment for their best promotion, but they are unwilling to provide even marginally good customer service. After watching my bills climb to $186/month, I requested a disconnect and paid what I was told would be my last payment of $186 last night. I woke up this morning to find that the payment went through to my credit card along with another unauthorized payment of $209. I spent the day trying to get through to the billing department who told me that they would have to send ""a ticket"" to the finance department to have the unauthorized payment reviewed. When I asked to how long it would take to be reimbursed, they said they didn't know. When I asked to speak to someone in the finance department, they said that they couldn't connect me through. I've learned that if you ask too many questions, they just hang up the phone. After four phone disconnects in two weeks, I realized that must be how they are instructed to resolve a conversation. Comcast spends high marketing dollars on free visa gift cards if you refer a friend. Are you kidding me??? If I did that, I wouldn't have any friends.",
"Really Comcast? It's not enough that I pay $200+ per month for your services, but you want to charge me an additional $1.99 per episode to watch ""The Shield!"" A series that was free to watch when it came out on FX! I've heard you do this also with other episodes of old shows that were free to watch when they originally came out! I consider this gouging your customers! :(",
"We only have Comcast bundling out here in Western Mass. You can not even get a bundle thru AT&T and DirecTV. So they jumped my bill up 17.00 this month, stating they had to so Comcast would not lose channels and we have to pay for a service that is awful. I constantly lose internet service. We need help here in Western Mass. This is awful, we can get treated like this!",
"From the first day it was a headache. The technician came out to install and as soon as he started it was already not what I wanted. He added an extra box, apparently an extra outlet and the channels that I wanted were not included with the original price. Then he continuously ignored me asking him to stop the installation process. I decided to call Comcast so they could at least cancel on their end which even though they agreed to, they never actually did. After the installation was complete the technician refused to uninstall saying that it would take a lot of work and he had other jobs to get to. After enough arguing he agreed to come back when done with the other clients which he never did. I was definitely shocked when my first bill was over $300. When I refused to pay it the service was suspended and I was told that to fix any charges I needed to restore it first. There would be a reconnect fee as well as another $200 added on because it would start a new billing cycle. I figured that it would be fixed anyway so it would be ok. However at some point between my dozens of calls I found out that I was in a contract so not only could I not adjust anything I also could not cancel because of early termination fees. Again I refused to pay and was told that a supervisor would contact me to fix this and waited for a call which never came. The account was again put into suspension and is now disconnected with the added cancellation fees totaling $784 for the last 3 months. To top it off I'm once again waiting on a supervisor to return my calls and I am dropping off the equipment to avoid an additional $470. What a nightmare!!",
"In Massachusetts, in bill dated November 27th, Comcast gave notice of price increase effective December 11, 2014. That is very short notice of time. Comcast refuses to reply to me as to why the short time. I am interested in finding out if this is Comcast's policy in the other states. So I am asking people to respond by identifying their state and advising the date of the most recent price increase notice they have received from Comcast and the date of that price increase takes effect in their billing process. In short: date you received notice + date your bank or credit card was debited for the increase. So that this site is not filled with numerous duplicate responses from the same state, please check the answers to see if someone in your state has already responded before you answer.",
"Ongoing problems over one year. They have replaced every item in my house and out to the pole, more than once. Management support, corporate involvement. It doesn't work. Intermittent repetitive issues. Every time, you start from square one. FRUSTRATION. There should come a time when Comcast states... WE CAN'T FIX IT. Time to move on. Has anyone else had a similar experience with the X1 Platform?",
"I was going to pay my past due bill of 258.00 so that I can get services reconnected, but a Comcast employee told me I also must pay a past due bill of a relative. I asked them why when it's not under my name, they went on to tell me, well since that person is related to me I also must pay that past due bill in order to get service under my name. I ask how is it possible to be billed for another person's past due bill, they said it's a policy of theirs that a relative must be charged with an unpaid bill. So in other words I have to be another's past due bill account even though it's clearly not under my name or social security number. I really don't know how that's possible.",
"Comcast, you are robbing customers that made you to stay in business. Most horrified customer service experience. I hope you burn in Hell! It's shame shame shame. I am switching to RCN.",
"I pay for ""Blast"" Internet service with speeds advertised as up to 105Mbps. Not only have I not come close to this speed (the Xfinity service technician ran the Xfinity Speed Test and I was at 13 Mbps), but for the past several weeks and currently, my internet speed is running at a blistering 0.21 Mbps. I called in to ask for a credit to my account for internet speed which is less than their basic internet package speed. I was told that as long as I get any internet service at all, I am not entitled to a credit. That is completely ridiculous as I am paying for speed that I rarely get.",
"I used to pay my Comcast bill automatically every month with a credit card. Then my credit card got hacked, and Comcast's attempt to bill it failed. The bank got me a new credit card with a new account number, which I gave to Comcast. But the Comcast billing system seemed to have blacklisted me for the hacked credit card. From then on, whenever my bill was due, it refused to bill my new credit card--without notifying me. As a result, I would be watching TV and suddenly my service would go out.I would call Comcast's service representative and be told that my service was canceled due to nonpayment. This happened twice. Each time, I would give Comcast my new credit card number.  Each time, they assured me it would work. And each time, it failed silently and Comcast just cut off my TV service for alleged nonpayment. I told them that if it happened again, I was canceling my service. It did happen, and without further ado, I switched to DirecTV.",
"I contacted Comcast, reluctantly, after hearing of so many fraudulent practices, but they are the only gig in town. I called to order internet and cable service. I was told that I would get internet service and a basic cable service with 25 channels for only 39.99 and was also told that I couldn't get internet service only (I don't watch TV). I set up an installation date, rearranged my schedule to meet their needs and never received a confirmation letter. In the meantime, I needed internet service so I went to their website which states that you can receive free wi-fi through many different hotspots. They did provide me with a free hour of service. When the service expired, I went back to looking for the free ""hotspots"" and connected to a secure free x-finity network. However, to get service, I had to pay 19.99, nothing FREE about that, which would take me up to the day they were coming. I called them on that day to confirm and they said that my installation date was a week from that date. I explained that I had been told that day and they apologized. I then asked for a credit for the 19.99, as a courtesy, plus the 19.99 I would be charged for the extra week, plus the 19.99 for the other computer in the house (the 19.99 connection can only be accessed through one device).The customer service rep. put me on hold and came back and said that my bill would reflect a credit from the 70.00 monthly fee that I would be paying. I asked for the original price quoted, plus email confirmation of the installation date, plus credit for having to pay a weekly fee on each computer. I was told I would receive those emails in 5 minutes or so. I received no notification. How did I resolve it? I chose VERIZON instead. I can't get cable TV through them, only satellite, but I wasn't lied to and am not having money extorted from me. Why Comcast is allowed to continue to function under their current fraudulent business practices is beyond me.",
"We have been a Comcast customer for over 15 years at home and have other accounts too. I tried to change our services online as we hardly ever watch TV. Currently, we are paying close to $300 per month for TV, internet and cable. I tried to get $99 per month triple play and it would not let me. I signed as a new customer and got a call in less than a minute, but found out I have to call a different number. When I call the customer service, I was on hold and listening to advertisement for about 15 minutes and then they told me I have to call back on a week day. I ended up cancelling my service and sign up for a new service the next day. That saved me about $3000 per year. Anyone who feels they can charge existing clients about 300% of new customer price, needs to reconsider their business strategy!",
"I wanted to change the number of channels I receive which one would think would be easy to do.... alas over 90 min later with a rep on the line I am still being ""put on hold"". He keeps telling me things that are useless to me like ""Comcast does have packages that start under $100 for new customers"".... Well as a 10+ year Comcast customer, apparently those packages are not available to me, so why tease me! Just give me a fair price for a package that I can use!",
"Comcast has a terrible customer service. My wife was on phone with at least four different reps., asked for mgr and while talking was disconnected. Called back and asked for same mgr and the rep said they will call back, but never did. TERRIBLE SERVICE. I work for a utility co. myself and if we EVER TREATED OUR CUSTOMERS LIKE THIS we would be out of a job. COMCAST SMARTEN UP, will probably look for NEW INTERNET co.",
"The set top box had a defective HDMI port. I took it to the service center - a half hour drive, because they have closed the service center in my town. I was the 8th person in line, with only one person working at the desk. After half an hour, I finally got a new box. I drove home another half hour. The new set top box was defective. After waiting on the phone 20 minutes, and minimal troubleshooting, they set up an appointment to send a technician. They made the appointment for a place I own that is 3 hours away. When I called, they told me the earliest appointment they had was a week and a half away! After complaining, they moved the appointment up by 3 days. The most they could credit my account for all of this outage and failure was $20.00. What horrible service!",
