complaints_text_massachusetts,complaints_text_arizona
"I am a client of Comcast Business Internet for the past 4 years. A couple of days ago, they performed a migration from Microsoft Exchange 2007 to Microsoft Exchange 2010. They sent me an email stating that this migration will be performed on Sat night 11pm to 7am Sun (May 31, 2014 to June 1, 2014) at which time my internet services will be interrupted. However, when the service was resumed on Sunday night (much later than they said in their email), I found that they had changed my server address (which ends in comcast.net). This change in server address had a drastic effect on my Business Contact Manager within MS Outlook. It literally made it impossible for me to access my list of business contacts and their information. Over the past 4 years, I had built a list of 2,250 email subscribers and my whole business is dependent on this list. I have called their technical support list for several times now and their reps keep saying they have passed this ticket to their Tier 2 tech and they will be calling me. But I have not heard a word from Comcast's Tier 2 tech support. I feel I've been sidelined and abandoned. They created a big problem for me with this migration and now they don't want to assist in resolving this matter. Almost all of the Comcast reps I have spoken to seem to be passing the buck, claiming the problem is with me or with Microsoft.I wish these tech reps at Comcast will stop dilly dallying and get back to me promptly to resolve this huge problem that they had created due to their negligence. They failed to consider the consequences on changing the server settings on the Business Contact Manager in MS Outlook of their clients. What is really frustrating for me is that no one from their Tier 2 tech support called me up to now. Today is the 3rd day I am waiting. They just kept me waiting like they don't care. On the other hand, I am so anxious and desperate that I restraint myself from going to the bathroom as I don't want to miss their call. I am even eating my meals at the computer table so I don't miss the call from them. They have put me in so much stress for the past 3 days and they seem like they just don't care.",
"I don't own a TV. Comcast provides me with internet. They've charged me $50 to fix a problem that was their fault. They have sent me adapters, remotes, a new router without me ordering them!! Then in the tiniest writing possible, somewhere under a flap of the box it says, ""If you don't return this product in 5 days, we will begin to start charging you $ for our products"". That's such crap!! I have to take time out of my day to go to the post office or find a UPS store, find parking, wait in line, then drop off a product that I can't even USE and did not order otherwise I will be charged?! This should be illegal! I'm canceling the service.",
"We were loyal Comcast customers for twenty years. Due to financial incentives, we went with Verizon this month (March 12, 2013). We returned the Comcast box and modem to their service center the next day. Several years ago the router they provided us with failed and Comcast told us we had to get a new one at our expense, which we did. Now they claim they want the defective router returned and we have no idea what happened to it. Verizon provides a modem/router unit and Comcast is trying to charge us $45.00 for the old router. Why didn't they ask before? You think we'll ever be Comcast customers again and that we won't tell others of our experience?",
"The actual download speeds to our house at **, Somerville, MA are consistently around 2.5 mbps as measured by the FCC's speed test. Comcast's speed test consistently returns a download speed of 12 mbps. The FCC's numbers confer the dead in the water download speeds we experience. You are not delivering anything close to rates your plans are sold at. I'm tired of complaining and will be starting two class action suits against Comcast if you don't start delivering on your commitments and stop falsifying your speed test results.",
"After seeing a promotion for $150 Visa Gift Card with bundled service, I decided to try Comcast. I was to have my service installed mid-October. The day before installation, I received a call from a rep telling me my installation needed to be rescheduled because there was no service contract on file. Without that, I could not receive my promotion. I was connected to a department where answers to their questions were recorded. It was a verbal agreement to a 2-year contract with them. I was told it would take 3 months to receive my gift card. When March arrived and I had not received my card, I called to inquire about it. I was told someone would get back to me. April came, and I called again. For the second time, I was told someone would get back to me. By the time May 2 came along, I was furious. I called and was told she personally would get back to me, which she did not. I called yet again on the 8th and the man gave me my word he would look further into this and he would personally call me before the day ended. Guess what? It never happened. This morning, I spoke to yet another rep. He put me on hold for a brief period of time and came back to tell me there was no contract on file. I insisted I did indeed have my conversation recorded for a verbal contract. Now he is looking into this, saying that without a contract, I could not qualify for the gift card. He gave me his number and extension and I am to call him in a week if no one gets back to me. I am beyond angry at this point. If they don't keep their word and send me my Visa card, they can take their service and shove it where the sun don't shine. I never had a problem with RCN. I should have stayed with them, but I will definitely be returning to them!",
"I manage my husband's solo pediatric practice. Reliable phone and internet service are critical for our patients. Comcast is responsible for our phones and internet and it is very unreliable! On a busy Monday morning, like this morning, the phones go down for 30 minutes and Comcast can't tell us why. Worse, they do nothing to keep it from happening again. I pay for service that I don't get. I want Comcast to fix the problems so that phone and internet are reliable. ",
"I am writing to let you know of an issue I'm having with Comcast Customer Service. Please bear in mind, I've been a customer for 3 days. Roughly an hour after the install, my service was intermittent and the phone support folks were not able to help and suggested sending someone out to my home. Now, the appointment was scheduled for today (28 Feb 2012) between 6-7 PM. The tech didn't show and claimed I wasn't home. This is demonstrably false, I've been sitting here since 5:30 PM, waiting. No phone call, door bell ring, nothing. This is upsetting to me.I had to leave work early to get home for the appointment and that isn't easy to do. I also depend on the service which, at the moment, isn't working. Not only did the tech lie to his boss, he put me out as well. I expect a higher level of service from you and am very disappointed.",
"I use Comcast for Internet connection only. I have no choice whatsoever and pay $63.66 monthly. Out of curiosity, I checked the cost of internet connection in London (Pond Sterling 3.25), in Paris (10 Euros) and in Berlin (12 Euros). I wonder why an Internet connection in the US should be by far, more expensive?",
"As Comcast was the cable provider servicing the address of the home I purchased, I was forced to attempt to set up service with them. While on the phone with a local rep, she called the previous owners and got an okay from them to terminate service in their name. What ensued was madness.I set up installation appointments (multiple), only to have them cancelled by Comcast, because ""service already exists"" at that address. No lie, something like 10 phone calls later, I achieved installation. Despite this, my first bill was sent to the wrong address. When I called to see where my bill was, and to pay it, I was informed of this fact. I then paid my bill in full, over the phone. I checked, as always, to make sure that the payment was actually deducted from my bank account. It was.Next month (second month of service), I received a bill stating that my account was past due and my service was being shut off. A call to ""customer service"" (India), was met with a robotic, scripted response that had nothing to do with the questions I was asking. I was informed that my payment had been ""misapplied"". What!? To where, and whom? It was like pulling teeth to get ""India"" to transfer me to a supervisor or billing rep. There I was informed that my payment had been removed from my account and credited to another account. How could this happen, you may ask?The other account holder called up, and giving just the last 4 numbers of the debit card I used to pay, stated that it was his $300 payment. What did Comcast do to verify? They looked to see if anyone had made a $300 payment on the date in question using those last 4 CC numbers. True CIA level security measures! They then suggested I monitor that card for fraud. Not a bad idea. I suggested they ramp up their billing security.",
"I made an appointment for Comcast technician to come install the internet on 08/20, which is a Saturday. I wrote down the appointment date and time and was sure I made an appointment on Saturday, since I work Monday to Friday. On Friday 08/19, I got a call on my cellphone at work from a Comcast technician telling me he is at the door. I was so surprised because I was sure the appointment was next day. The guy had a really bad attitude and was impatient to check up the schedule per my request. Then he admitted it's the wrong day and hung up. The next day, Saturday afternoon, I stayed at home the entire afternoon and nobody showed up. Then I called the technician since I got his number on my call display earlier. I called him first time, he picked up and grumbled and hung up on me. Then I called again, he picked up and heard it was me again and hung up again. I was furious, then I called Comcast customer service. The customer service representative also had a really bad attitude and told me ""well, we don't have appointment until September. Now, do you want to keep it or not now?"". I was appalled. I have never had worst customer service experience in my life. ",
"I called Comcast on 10/01/2010 and ordered the new Internet 2go said the order was in and would see this item by 10/6/2010. Well, since then till 10/11/2010, I have called and asked for a tracking number and they keep saying they do not have one but it shipped. Today, I called them and they admitted it has not shipped and this was a new item for them in this area an they were trying to figure out where it was, but it look like it did not ship and they did not know how to ship it but would call me about 6 pm on 10/12/2010.Well, as you guessed it, they did not call so I called them back, again that nice apology, let me put you on hold an I will talk to a supervisor. On hold for 5 minutes and she came back and said there still working on it and earlier in the day I asked it to be shipped red and ship me another one. Guess what? They still wanna look for the other one.Earlier in the day was also told they did not know how to or where they are at to ship. I also said hum you must new on the job and seems no one knows what to do with any training and she said I been here only three days. Being in the customer service industry, big bells and whistles went of no training, high turn over, everything is scripted. Such a shame , I am now handicapped and I was gonna use this technology to make my life easier away from home. Maybe Comcast should start listening to there customers. Is Verizon FIOS any better? Lost of time and wages plus stress = $500.00",
"We pay almost $150 per month for service which includes internet!  We constantly have email issues due to Comcast IP issues.  They try to filter spam so our outbound email always gets bounced back.  I have spent at least 20 hours on the phone and internet trying to fix it and it keeps coming back.  They are our only choice, so they feel they can stick it to us as we have no choice.  The worst thing is they never notify you of issues and just do what they want.  Then when you call for help, they say someone will call you back and they usually don’t.",
Absolutely awful. Constant problems. I don't watch a lot of tv. Every time I do put it on my channels won't show up that I'm already subscribed to saying to subscribe to get them so I have to contact them and go through the same hassle over and over again. Ridiculous.,
"Comcast has been terrible to work with at every turn. Every time I've had to call them to discuss charges on my bill, rate increases, slow internet and cable issues. I've spent over a half hour on the phone and usually do not get the issue resolved. If there was any other company available to use for internet and TV in my area I would immediately switch.Today, my fiancé wanted to take over the Comcast bill when we moved so we were getting it turned on in her name. We entered our new address on the website and it gave us a listing of packages based on our address, we clicked ""add to cart"" on the one we wanted and it brought us to higher priced packages. Their customer ""service"" said that it wasn't available in our area but as indicated in the screenshot image attached, they are advertising it as available based on our address. Finally they agreed that it should be available for our area but told us to clear our cookies. We cleared our cookies and it immediately disconnected us. The problem continued and we literally had the exact same conversation with the next customer service rep. After I refused to clear the cookies again he told me there was nothing he could do to help.",
"I signed up for Comcast being told 500 Visa card. I got charged entire bundle then I'm only got basic. Few months later I get the box. Box is not registered so I'm on the phone for days. Then I'm waiting 10 months for Visa card... threaten a lawsuit. I get 100 gift card and another one for 50.00. I called a high up rep who went through all recorded calls, restarted my bundle, and gave me lower rate for yr 3 and 4 then a 290.00 box credit for final year. So 90.00 to 114.00 was my quote and I'm also paying 250.00 a month being shut off 2 times a month. They were individually charging me for everything. Kristin ** I believe executive customer relation in 2015 fixed it all. Now Comcast tells me they're not honoring her deal. I'm being overcharged, plus I'm being shut off. I also am still 2 yrs later waiting for 350.00 left on owed Visa card and past the deal. How am I not getting? Visa GC IS A SCAM..",
"After settling into our new home, my fiance and I, after 3 years, decided to finally get cable (we both work all day, so cable did not seem like a necessity). Because of our location, only 2 cable providers were available, Comcast and Dish Network. We called Comcast first to hear of any deals, and the sales rep told us of an 89.99 deal they were running. Only wanting a few channels, the sales rep asked us to name channels that we want so he could match a package to us. We named HGTV, Travel Channel, Food Network, as well as a few children's channels. He named a $54.99 package with 75 mbps internet and all of the channels we named included in the package. This sounded like the perfect deal!Before getting off the phone my fiance asked for the full price (including taxes) and the sales rep said it would be $54.99 plus an extra $10/month for the router and modem. We decided to just buy the router and modem to avoid the $10/month, knowing that, he gave us a price of roughly around $61/month. Perfect! Today they came to install everything, and excited to come home and settle in after work, I flipped through the channels to find the channels that were promised not available.We immediately called Comcast customer service and they stated that the 'economy plan' that we were apart of did not include the channels we named. We were also informed that we would be paying an extra $10/month for HD, and we DID NOT agree to this! The original sales rep just 'yessed and okayed' everything we asked for and completely misinterpreted the deal to us to get up to buy his product. This is NOT fair. This is NOT ok. Had we known the channels we wanted were not included, we would have never gotten cable. It is not a necessity for us, it is a luxury. The sales rep falsely advertised what he was selling to us. The customer service rep had nothing to say other than she will waive the installation fees. I have read MANY complaints online of people who have gone through the same thing as we have. Comcast sales reps need to be honest and upfront to their consumers!",
"We had a very nice installer put Xfinity DVR service for 3 rooms into our house yesterday. It worked great for that afternoon. Last night a recording showed oddness (stalling and hard to restart), then this afternoon the DVR box went into a reboot loop. It shuts off, goes through its boot process, gets a bit into that, then does it again and again. That is not the reason for this review - that is a piece of new computer hardware and they break usually very soon after turning them on if they are going to break. BUT we called customer service and told them we have been a customer for about 24 hours and the box broke. They said, ""No repair person will be available for 5 days"". 5 days?? This is the cheapest crap box company I have ever known. They do not hire sufficient techs, they don't offer refunds etc. If you have a choice, DONT use them!",
"I wrote a few days ago about the unbelievably poor customer service I have been receiving regarding unwarranted charges to my account. I still have a $496 charge when my costs should have been $109. Everyone admits the problem is on their end, but in over 10 days, no refund. I will continue writing all over the internet until something changes. NO COMPANY should be in business with a 0% customer service satisfaction. BTW, the better customer service number is 800 266 2278. If you call 800XFINITY you get the Philippines. At least I get to speak with someone here in this country and someone who will offer a direct line# when you have problems that have been as outrageously unresolved as I have.Now I have no service and called CS again yesterday. First I was told ""there is NO SUCH THING as SAME DAY SERVICE...."" then I was given a choice of between 8A to 10A or 10A to 12N for today. I chose the latter. I called at 11:40A because we hadn't even received the advance phone call. I was told he updated and said he would be there between 11:30A and 12N. At 12:39, I called again and was told I was RESCHEDULED now between 1P and 3P with expected arrival between 2P and 2:30P....no phone call....RESCHEDULED arrival??? They said they had me down for 8A to 10A, which makes this new time even MORE EGREGIOUS. What's wrong with this company? How do you ever stay in business? I now had to reschedule to TUESDAY because of appointments on Monday. My tenant has been without TV and internet since FRIDAY. Does anyone at this company even care? I have at least 4 ticket numbers that I have taken the time to save. With the other calls I just asked them ""What difference would it make?"" I was told ""none."" If you have a choice, go with Verizon Fios or any other company. ",
"I recently called Comcast just to activate internet only because I was going to go with DirecTV. The rep told me that I would pay less if I bundled internet and cable. I asked him to explain the packages to me which he did. He told me that I could get 75 Mbps plus 2 DVR's and one cable box all for $126.90 TOTAL including ALL fees. Guess what? Boxes came yesterday and internet is only 25 Mbps and my bill is $154. When I called CS, they told me that they are not responsible for what their rep discusses over the phone??? How is that possible? I was told that if I wanted 75 Mbps, there would be an extra fee of $10. I asked if they record the conversations and they said they did not know who I spoke with. This just doesn't seem right. If we aren't satisfied for any reason within 30 days, we can cancel.",
"My mother's phone was out and I called for service, saying she is 97 years old and needs a phone at all times. The service people checked the connection and said that indeed, she DID need a technician and that on an emergency basis, they would get one out the next day. I went to her home which is in a retirement community to wait. After a couple of hours, I decided to call them to make sure they knew where it was, and get an update from them.I got on the automated service, gave my phone number, and they told me they would be there within the next half hour. ""Great,"" I thought. Then the automated service said, ""Do you want to cancel this appointment?"" I said, ""NO!"" The automated voice came back and said, ""Your appointment is canceled."" Needless to say, I was very upset. It took me eight minutes to get to a real person after that, and they said that there was NOTHING they could do about this. They would send another technician out tomorrow. This was totally unacceptable and unbelievable to me. SO close and yet SO far away. When I called customer service again this morning, it was more of the same. No recompense except for the two days that her service was out. Her service had been out for a few days previous to this, but they did not count this because no one had called to complain. I still feel violated for hours of my time.",
"Comcast for some reason credited our account for 1704.00 for 3 months in which time I was receiving bills saying No Payment Due but they then reversed the credit and billed me for all 3 months at once. Not sure if this is legal but contacted Customer Service and he just kept saying, ""I have no idea what happened but your bill is correct now,"" so I contacted Corporate Office. They stated that someone would call me by the end of the day in which they didn't, so I called again today got a woman who said, ""Well your issue was resolved. The credit was an error so we have fixed your account and you now owe the three months you weren't billed for."" I asked her how their mess up was fair to us. She said, ""Well it's your bill and you owe it! It was a mistake and it has been dealt with. It was done in error. I don't know who did it and why but it's over.""They are without a doubt the worst Company to have to deal with!!! They should be investigated because they do things that are so illegal... i.e. calling and leaving lengthy messages regarding overdue bills stating how much is owed and what will happen if you don't pay the overdue amount, yet when I called to complain about that I was told that ""FINE we will put you on the do not call list and if your phone gets shut off don't blame us"" and then dial tone!!! RUDE and illegal leaving personal information on an answering machine when again I called Corporate they stated they don't go by Mass Laws... Really I guess they are special...",
"I have been a customer for nearly 2 years. This company’s ONLY time of good prices is for the initial time period of a contract. After that the shake down begins, but also the service is HORRENDOUS!!! Very intermittent, never at the level that you are promised, but they charge you for it and brag about themselves as if their ads matter more than what they deliver. They beat you into submission because the only alternative is to block out five plus hours of your day for an incompetent technician to show up and basically change NOTHING... I know that most of the people using Comcast have no other choice or they wouldn't be here using it. This is the way it is. Like mafia the companies each mark out their territories and do their shakedowns... This is the one thing you can rely on with their services. You will be shaken down... period.Their service sucks. It is advisable to be very creative in your search for services before getting involved with them. It will become a headache you wish to avoid in no time at all. Wait lines for complaints are so long. This way the majority of us hang up before they have to be accountable... and like I say their technicians haven't got a clue what they are doing so a visit to your house is just a reminder of who is in charge so long as you are getting service from them.There are no basic services that are affordable. All there are is supposedly discounted services for the first year, which are high even to begin with, and then they trump up to ridiculous levels as the contract runs out. If only what they promised was what you got, but it isn't and trying to explain that, or get credits for it, well you have to put up with more home visits from their incompetent techs before they even talk to you about it. Their business relies on your not having a backup plan or ability to switch out. Don't go with this company. Try some creative start up. They just want your money through whatever creative means they can get it. Their services suck and are nothing to rely on, and nothing like as advertised!!!",
